[
  {
    "name": "Auth0",
    "slug": "auth0",
    "category": "auth",
    "url": "https://auth0.com",
    "page": "https://agentstacklist.com/tools/auth0/",
    "fit_score": 4,
    "has_mcp": false,
    "has_skill": true,
    "agent_scores": {
      "claude-code": 4,
      "codex": null,
      "cursor": 3,
      "github-copilot": null,
      "antigravity": null
    },
    "description": "Enterprise-grade auth, easy to implement. Add login, SSO, MFA, and access control to any app with framework-aware guidance."
  },
  {
    "name": "WorkOS",
    "slug": "workos",
    "category": "auth",
    "url": "https://workos.com",
    "page": "https://agentstacklist.com/tools/workos/",
    "fit_score": 4,
    "has_mcp": false,
    "has_skill": true,
    "agent_scores": {
      "claude-code": 4,
      "codex": null,
      "cursor": null,
      "github-copilot": null,
      "antigravity": null
    },
    "description": "WorkOS integration skills for AuthKit, SSO, Directory Sync, RBAC, Vault, Audit Logs, migrations, and API references."
  },
  {
    "name": "Supabase",
    "slug": "supabase",
    "category": "database",
    "url": "https://supabase.com",
    "page": "https://agentstacklist.com/tools/supabase/",
    "fit_score": 5,
    "has_mcp": true,
    "has_skill": true,
    "agent_scores": {
      "claude-code": 5,
      "codex": null,
      "cursor": 4,
      "github-copilot": null,
      "antigravity": 5
    },
    "description": "Supabase MCP integration for database operations, authentication, storage, and real-time subscriptions. Manage your Supabase projects, run SQL queries, and interact with your backend directly."
  },
  {
    "name": "Firebase",
    "slug": "firebase",
    "category": "auth",
    "url": "https://firebase.google.com",
    "page": "https://agentstacklist.com/tools/firebase/",
    "fit_score": 4,
    "has_mcp": true,
    "has_skill": false,
    "agent_scores": {
      "claude-code": 4,
      "codex": null,
      "cursor": 3,
      "github-copilot": 3,
      "antigravity": 3
    },
    "description": "Google Firebase MCP integration. Manage Firestore databases, authentication, cloud functions, hosting, and storage. Build and manage your Firebase backend directly from your development workflow."
  },
  {
    "name": "Neon",
    "slug": "neon",
    "category": "database",
    "url": "https://neon.tech",
    "page": "https://agentstacklist.com/tools/neon/",
    "fit_score": 5,
    "has_mcp": true,
    "has_skill": true,
    "agent_scores": {
      "claude-code": 5,
      "codex": 5,
      "cursor": 5,
      "github-copilot": null,
      "antigravity": 5
    },
    "description": "Manage your Neon projects and databases with the neon-postgres agent skill and the Neon MCP Server."
  },
  {
    "name": "PlanetScale",
    "slug": "planetscale",
    "category": "database",
    "url": "https://planetscale.com",
    "page": "https://agentstacklist.com/tools/planetscale/",
    "fit_score": 4,
    "has_mcp": true,
    "has_skill": false,
    "agent_scores": {
      "claude-code": 4,
      "codex": null,
      "cursor": null,
      "github-copilot": null,
      "antigravity": null
    },
    "description": "An authenticated hosted MCP server that accesses your PlanetScale organizations, databases, branches, schema, and Insights data. Query against your data, surface slow queries, and get organizational and account information."
  },
  {
    "name": "MongoDB",
    "slug": "mongodb",
    "category": "database",
    "url": "https://www.mongodb.com",
    "page": "https://agentstacklist.com/tools/mongodb/",
    "fit_score": 5,
    "has_mcp": true,
    "has_skill": true,
    "agent_scores": {
      "claude-code": 5,
      "codex": null,
      "cursor": null,
      "github-copilot": null,
      "antigravity": null
    },
    "description": "Official Claude plugin for MongoDB (MCP Server + Skills). Connect to databases, explore data, manage collections, optimize queries, generate reliable code, implement best practices, develop advanced features, and more."
  },
  {
    "name": "Convex",
    "slug": "convex",
    "category": "database",
    "url": "https://convex.dev",
    "page": "https://agentstacklist.com/tools/convex/",
    "fit_score": 5,
    "has_mcp": true,
    "has_skill": true,
    "agent_scores": {
      "claude-code": 5,
      "codex": null,
      "cursor": null,
      "github-copilot": null,
      "antigravity": null
    },
    "description": "Official Convex plugin for Claude Code with bundled Convex skills, the convex-expert subagent for code-writing, a runtime-error monitor, and MCP access for backend development, schema design, real-time features, auth, file storage, scheduled jobs, and AI agents."
  },
  {
    "name": "Prisma Postgres",
    "slug": "prisma-postgres",
    "category": "database",
    "url": "https://prisma.io",
    "page": "https://agentstacklist.com/tools/prisma-postgres/",
    "fit_score": 4,
    "has_mcp": true,
    "has_skill": false,
    "agent_scores": {
      "claude-code": 4,
      "codex": null,
      "cursor": null,
      "github-copilot": null,
      "antigravity": null
    },
    "description": "Prisma MCP integration for Postgres database management, schema migrations, SQL queries, and connection string management. Provision Prisma Postgres databases, run migrations, and interact with your data directly."
  },
  {
    "name": "CockroachDB",
    "slug": "cockroachdb",
    "category": "database",
    "url": "https://www.cockroachlabs.com",
    "page": "https://agentstacklist.com/tools/cockroachdb/",
    "fit_score": 4,
    "has_mcp": true,
    "has_skill": false,
    "agent_scores": {
      "claude-code": 4,
      "codex": null,
      "cursor": null,
      "github-copilot": null,
      "antigravity": null
    },
    "description": "Connect Claude Code directly to your CockroachDB clusters for hands-on database work — explore schemas, write optimized SQL, debug queries, and manage distributed database clusters. This plugin provides 14 tools across two active MCP backends (self-hosted MCP Toolbox and managed CockroachDB Cloud MCP Server), three specialized agents (DBA, Developer, Operator), 32 skills across 6 operational domains, and built-in safety hooks."
  },
  {
    "name": "Redis",
    "slug": "redis",
    "category": "database",
    "url": "https://redis.io",
    "page": "https://agentstacklist.com/tools/redis/",
    "fit_score": 4,
    "has_mcp": false,
    "has_skill": true,
    "agent_scores": {
      "claude-code": 4,
      "codex": null,
      "cursor": null,
      "github-copilot": null,
      "antigravity": null
    },
    "description": "Redis development best practices — data structures, query engine, vector search, caching, and performance optimization"
  },
  {
    "name": "Appwrite",
    "slug": "appwrite",
    "category": "database",
    "url": "https://appwrite.io",
    "page": "https://agentstacklist.com/tools/appwrite/",
    "fit_score": 5,
    "has_mcp": true,
    "has_skill": true,
    "agent_scores": {
      "claude-code": 5,
      "codex": null,
      "cursor": null,
      "github-copilot": null,
      "antigravity": null
    },
    "description": "Appwrite tools for Claude Code, including SDK skills, Appwrite MCP servers, and deployment commands."
  },
  {
    "name": "Stripe",
    "slug": "stripe",
    "category": "payments",
    "url": "https://stripe.com",
    "page": "https://agentstacklist.com/tools/stripe/",
    "fit_score": 5,
    "has_mcp": true,
    "has_skill": true,
    "agent_scores": {
      "claude-code": 5,
      "codex": 4,
      "cursor": 4,
      "github-copilot": 4,
      "antigravity": null
    },
    "description": "Stripe development plugin for Claude"
  },
  {
    "name": "PayPal",
    "slug": "paypal",
    "category": "payments",
    "url": "https://developer.paypal.com",
    "page": "https://agentstacklist.com/tools/paypal/",
    "fit_score": 5,
    "has_mcp": true,
    "has_skill": true,
    "agent_scores": {
      "claude-code": 5,
      "codex": null,
      "cursor": null,
      "github-copilot": null,
      "antigravity": null
    },
    "description": "PayPal development plugin for Claude — integrate payments, subscriptions, invoices, disputes, and more using PayPal's APIs and MCP server"
  },
  {
    "name": "RevenueCat",
    "slug": "revenuecat",
    "category": "payments",
    "url": "https://www.revenuecat.com",
    "page": "https://agentstacklist.com/tools/revenuecat/",
    "fit_score": 5,
    "has_mcp": true,
    "has_skill": true,
    "agent_scores": {
      "claude-code": 5,
      "codex": null,
      "cursor": null,
      "github-copilot": null,
      "antigravity": null
    },
    "description": "Configure RevenueCat projects, apps, products, entitlements, and offerings directly from Claude Code. Manage your in-app purchase backend without leaving your development workflow."
  },
  {
    "name": "Vercel",
    "slug": "vercel",
    "category": "hosting",
    "url": "https://vercel.com",
    "page": "https://agentstacklist.com/tools/vercel/",
    "fit_score": 5,
    "has_mcp": true,
    "has_skill": true,
    "agent_scores": {
      "claude-code": 5,
      "codex": 4,
      "cursor": 4,
      "github-copilot": 4,
      "antigravity": null
    },
    "description": "Vercel deployment platform integration. Manage deployments, check build status, access logs, configure domains, and control your frontend infrastructure directly from Claude Code."
  },
  {
    "name": "Netlify",
    "slug": "netlify",
    "category": "hosting",
    "url": "https://netlify.com",
    "page": "https://agentstacklist.com/tools/netlify/",
    "fit_score": 5,
    "has_mcp": true,
    "has_skill": true,
    "agent_scores": {
      "claude-code": 5,
      "codex": 3,
      "cursor": null,
      "github-copilot": null,
      "antigravity": 3
    },
    "description": "Netlify platform skills for Claude Code — functions, edge functions, blobs, database, image CDN, forms, config, CLI, frameworks, caching, AI gateway, and deployment."
  },
  {